<?xml version="1.0" encoding="UTF-8"?>
<?xml-stylesheet type="text/xsl" ?>
<casaxml xmlns="http://casa.nrao.edu/schema/psetTypes.html"
	xmlns:xsi="http://www.w3.org/2001/XMLSchema-instance"
	xsi:schemaLocation="http://casa.nrao.edu/schema/casa.xsd file:///opt/casa/code/xmlcasa/xml/casa.xsd">

<task type="function" name="hsd_inspectdata" category="pipeline">
<shortdescription>Inspects whole data registered to context</shortdescription>
<description>
</description>
<input>
    <param type="string" name="pipelinemode">
	<description>The pipeline operating mode</description>
	<value>automatic</value>
	<allowed kind="enum">
	    <value>automatic</value>
	    <value>interactive</value>
	    <value>getinputs</value>
	</allowed>
    </param>

    <param type="stringArray" name="infiles" subparam="true">
        <description>List of input files to be inspected (default all)</description>
        <value></value>
    </param>

    <param type="bool" name="dryrun" subparam="true">
	<description>Run the task (False) or display task command (True)</description>
	<value>False</value>
    </param>

    <param type="bool" name="acceptresults" subparam="true">
	<description>Add the results into the pipeline context</description>
	<value>True</value>
    </param>

    <constraints>
	<when param="pipelinemode">
	    <equals type="string" value="automatic">
	    </equals>
	    <equals type="string" value="interactive">
                <default param="infiles"><value type="stringArray"></value></default>
		<default param="dryrun"><value type="bool">False</value></default>
		<default param="acceptresults"><value type="bool">True</value></default>
	    </equals>
	    <equals type="string" value="getinputs">
                <default param="infiles"><value type="stringArray"></value></default>
	    </equals>
	</when>
    </constraints>

</input>

<output>
    <param type="any" name="results">
        <description>The output results object</description>
        <any type="variant"/>
        <value></value>
    </param>
</output>
<returns type="void"/>


<example>
The hsd_inspectdata task inspects the data registered to the context. 
All the data must be imported via hsd_importdata task before inspection.

If this task is executed several times, inspection will be done from 
scratch, and previous inspection will be discarded.

Keyword arguments:

---- pipeline parameter arguments which can be set in any pipeline mode

pipelinemode -- The pipeline operating mode. In 'automatic' mode the pipeline
   determines the values of all context defined pipeline inputs
   automatically.  In 'interactive' mode the user can set the pipeline
   context defined parameters manually.  In 'getinputs' mode the user
   can check the settings of all pipeline parameters without running
   the task.
   default: 'automatic'.

---- pipeline context defined parameter argument which can be set only in
'interactive mode'

infiles -- List of data files. These must be a name of Scantables that 
   are registered to context via hsd_importdata task.
   default: []
   example: vis=['X227.PM01.asap', 'X227.PM02.asap']

--- pipeline task execution modes

dryrun -- Run the commands (True) or generate the commands to be run but
   do not execute (False).
   default: True

acceptresults -- Add the results of the task to the pipeline context (True) or
   reject them (False).
   default: True

Output:

results -- If pipeline mode is 'getinputs' then None is returned. Otherwise
   the results object for the pipeline task is returned.


Examples

1. Import data via hsd_importdata task and inspect them.

   hsd_importdata (infiles=['../rawdata/uid___A002_X30a93d_X43e',
                '../rawdata/uid_A002_x30a93d_X44e'])
   hsd_inspectdata()

2. Import data via hsd_importdata task and inspect some of them

   hsd_importdata (infiles=['../rawdata/uid___A002_X30a93d_X43e',
                '../rawdata/uid_A002_x30a93d_X44e'])
   hsd_inspectdata(infiles=['uid___A002_X30a93d_X43e.PM01.asap',
                            'uid___A002_X30a93d_X44e.PM01.asap'])

</example>
</task>
</casaxml>
