<?xml version="1.0" encoding="UTF-8"?>
<?xml-stylesheet type="text/xsl" ?>
<casaxml xmlns="http://casa.nrao.edu/schema/psetTypes.html"
      xmlns:xsi="http://www.w3.org/2001/XMLSchema-instance"
      xsi:schemaLocation="http://casa.nrao.edu/schema/casa.xsd
      file:///opt/casa/code/xmlcasa/xml/casa.xsd">

<task type="function" name="listfits" category="information">
	<shortdescription>List the HDU and typical data rows of a fits file:</shortdescription>
	<description>
	List the HDU and typical data rows of a fits file:
	The list will be given in the logger.
	</description>
	<input>
		<param type="string" name="fitsfile" mustexist="true">
			<description>Name of input fits file</description>
			<value></value>
		</param>
	</input>
<returns type="void"/>

<example>

	The HDU and typical data rows in a fits file are listed in the logger.

	Keyword arguments:
	fitsfile -- Name of input fits file 
		default: none; example: fitsfile='ngc5921.uvfits'
        async -- Run asynchronously 
  		default = False; do not run asychronously
 </example>
 </task>
 </casaxml>
