<?xml version="1.0" encoding="UTF-8"?>
<?xml-stylesheet type="text/xsl" ?>
<casaxml xmlns="http://casa.nrao.edu/schema/psetTypes.html"
xmlns:xsi="http://www.w3.org/2001/XMLSchema-instance"
xsi:schemaLocation="http://casa.nrao.edu/schema/casa.xsd
file:///opt/casa/code/xmlcasa/xml/casa.xsd">

<task type="function" name="hif_rawflagchans" category="pipeline">
<shortdescription>Flag deviant baseline/channels in raw data</shortdescription>
<description>
Flag deviant baseline/channels in raw data.
</description>
<input>
    <param type="stringArray" name="vis" subparam="true">
        <description>List of input measurement sets</description>
        <value></value>
    </param>

    <param type="string" name="spw" subparam="true">
        <description>Set of data selection spectral windows, \'\' for all</description>
        <value></value>
    </param>

    <param type="string" name="intent" subparam="true">
        <description>Data selection intent: default is first of BANDPASS, PHASE or AMPLITUDE to have data</description>
        <value></value>
    </param>

    <param type="bool" name="flag_hilo">
        <description>True to flag outlier baseline/channels</description>
        <value>True</value>
    </param>

    <param type="double" name="fhl_limit" subparam="true">
        <description>Flag baseline/channels further from median than limit * MAD</description>
        <value>20.0</value>
    </param>

    <param type="double" name="fhl_minsample" subparam="true">
        <description>Minimum number of points in sample</description>
        <value>5</value>
    </param>

    <param type="bool" name="flag_bad_quadrant">
        <description>True to flag bad quadrants in antennas</description>
        <value>True</value>
    </param>

    <param type="double" name="fbq_hilo_limit" subparam="true">
        <description>Note as \'suspect\' baseline/channels further from median than limit * MAD</description>
        <value>8.0</value>
    </param>

    <param type="double" name="fbq_antenna_frac_limit" subparam="true">
        <description>Flag antenna quadrant if its fraction of \'suspect\' baseline/channels > limit</description>
        <value>0.2</value>
    </param>

    <param type="double" name="fbq_baseline_frac_limit" subparam="true">
        <description>Flag baseline quadrant if its fraction of \'suspect\' baseline/channels > limit</description>
        <value>1.0</value>
    </param>

    <param type="string" name="pipelinemode">
        <description>The pipeline operations mode</description>
        <value>automatic</value>
        <allowed kind="enum">
            <value>automatic</value>
            <value>interactive</value>
            <value>getinputs</value>
        </allowed>
    </param>

    <param type="bool" name="dryrun" subparam="true">
        <description>Run the task (False) or list commands(True)</description>
       <value>False</value>
    </param>

    <param type="bool" name="acceptresults" subparam="true">
        <description>Automatically apply results to context</description>
        <value>True</value>
    </param>

    <constraints>
        <when param="pipelinemode">
            <equals type="string" value="automatic" />
            <equals type="string" value="interactive">
                <default param="vis"><value type="stringArray"></value></default>
                <default param="dryrun"><value type="bool">False</value></default>
                <default param="acceptresults"><value type="bool">True</value></default>
            </equals>
            <equals type="string" value="getinputs">
                <default param="vis"><value type="stringArray"></value></default>
            </equals>
        </when>

        <when param="flag_hilo">
            <equals type="bool" value="True">
                <default param="fhl_limit"><value>20.0</value></default>
                <default param="fhl_minsample"><value>5</value></default>
            </equals>
            <equals type="bool" value="False">
            </equals>
        </when>

        <when param="flag_bad_quadrant">
            <equals type="bool" value="True">
                <default param="fbq_hilo_limit"><value>8.0</value></default>
                <default param="fbq_antenna_frac_limit"><value>0.2</value></default>
                <default param="fbq_baseline_frac_limit"><value>1.0</value></default>
            </equals>
            <equals type="bool" value="False">
            </equals>
        </when>

    </constraints>
</input>

<output>
    <param type="any" name="results">
        <description>The output results object</description>
        <any type="variant"/>
        <value></value>
    </param>
</output>
<returns type="void"/>

<example>

hif_rawflagchans flags deviant baseline/channels in the raw data. 

The flagging views used are derived from the raw data for the specified 
intent - default the first of BANDPASS, PHASE and AMPLITUDE to have data. 

Bad baseline/channels are flagged for all intents, not just the
one that is the basis of the flagging views.

For each spectral window the flagging view is a 2d image with axes 
'channel' and 'baseline'. The pixel for each channel,baseline is the 
time average of the underlying unflagged raw data.

The baseline axis is labelled by numbers of form id1.id2 where id1 and id2
are the IDs of the baseline antennas. Both id1 and id2 run over all 
antenna IDs in the observation. This means that each baseline is shown 
twice but has the benefit that 'bad' antennas are easily identified by 
eye.

Three flagging methods are available:

If parameter flag_hilo is set True then outliers from the median
of each flagging view will be flagged.

If parameter flag_bad_quadrant is set True then a simple 2 part 
test is used to check for bad antenna quadrants and/or bad baseline 
quadrants. Here a 'quadrant' is defined simply as one quarter of the
channel axis. The first part of the test is to note as 'suspect' those
points further from the view median than fbq_hilo_limit * MAD.
The second part is to flag entire antenna/quadrants if their
fraction of suspect points exceeds fbq_antenna_frac_limit. 
Failing that, entire baseline/quadrants may be flagged if their 
fraction of suspect points exceeds fbq_baseline_frac_limit. 
Suspect points are not flagged unless as part of a bad antenna or 
baseline quadrant. 

Keyword arguments:

pipelinemode -- The pipeline operating mode. In 'automatic' mode the pipeline
   determines the values of all context defined pipeline inputs automatically.
   In interactive mode the user can set the pipeline context defined parameters
   manually.  In 'getinputs' mode the user can check the settings of all
   pipeline parameters without running the task.
   default: 'automatic'.

---- pipeline parameter arguments which can be set in any pipeline mode

flag_hilo -- True to flag channel/baseline data further from the view
             median than fhl_limit * MAD.
    default: True

fhl_limit -- If flag_hilo is True then flag channel/baseline data
             further from the view median than fhl_limit * MAD.
    default: 20

fhl_minsample -- Do no flagging if the view median and MAD are derived
                 from fewer than fhl_minsample view pixels.
    default: 5

flag_bad_quadrant -- True to search for and flag bad antenna quadrants
                     and baseline quadrants. Here a /'quadrant/' is one 
                     quarter of the channel axis.
    default: True

fbq_hilo_limit -- If flag_bad_quadrant is True then channel/baselines
                  further from the the view median than fbq_hilo_limit
                  * MAD will be noted as 'suspect'. If there are 
                  enough of them to indicate that an antenna or baseline
                  quadrant is bad then all channel/baselines in that
                  quadrant will be flagged.
    default: 8.0

fbq_antenna_frac_limit -- If flag_bad_quarant is True and the fraction
                          of suspect channel/baselines in a particular
                          antenna/quadrant exceeds fbq_antenna_frac_limit
                          then all data for that antenna/quadrant will
                          be flagged.
    default: 0.2

fbq_baseline_frac_limit -- If flag_bad_quarant is True and the fraction
                           of suspect channel/baselines in a particular
                           baseline/quadrant exceeds fbq_baseline_frac_limit
                           then all data for that baseline/quadrant will
                           be flagged.
    default: 1.0 (i.e. no flagging)

---- pipeline context defined parameter arguments which can be set only in
'interactive mode'

vis -- List of input measurement sets.
    default: [] - Use the measurement sets currently known to the pipeline
    context. 

-- Pipeline task execution modes

dryrun -- Run the commands (True) or generate the commands to be run but
          do not execute (False).
    default: True

acceptresults -- This parameter has no effect. The Tsyscal file is already
                 in the pipeline context and is flagged in situ.

Output:

results -- If pipeline mode is 'getinputs' then None is returned. Otherwise
    the results object for the pipeline task is returned.


Examples:

1. Flag bad quadrants and wild outliers, default method.

   hif_rawflagchans()
       equivalent to:
   hif_rawflagchans(flag_hilo=True, fhl_limit=20,
     flag_bad_quadrant=True, fbq_hilo_limit=8, 
     fbq_antenna_frac_limit=0.2, fbq_baseline_frac_limit=1.0)

</example> 

</task>
</casaxml>

