<?xml version="1.0" encoding="UTF-8"?>
<?xml-stylesheet type="text/xsl" ?>
<casaxml xmlns="http://casa.nrao.edu/schema/psetTypes.html"
xmlns:xsi="http://www.w3.org/2001/XMLSchema-instance"
xsi:schemaLocation="http://casa.nrao.edu/schema/casa.xsd
file:///opt/casa/code/tools/xml/casa.xsd">


   <tool name="singledishms" module="singledishms">
   <shortdescription>New single dish tool interface to process an MS</shortdescription>


<code>
	<include>tools/singledish/singledishms_forward.h</include>
<private>
	<include>tools/singledish/singledishms_private.h</include>
</private>
</code>
 
   <method type="constructor" name="singledishms">
   <shortdescription>Construct singledishms tool</shortdescription>
   
<description>
This is used to construct an {\tt singledishms} tool.
</description>
<input>
</input>
<returns type="singledishms"/>
<example>
Manual tool construction is done this way:

ssd = casac.singledishms()

</example>
</method>

<method type="function" name="open">
   <shortdescription>Open a new MeasurementSet for processing after closing current MeasurementSet
   </shortdescription>
<description>
Close the current MeasurementSet and open a new MeasurementSet
instead. The current state of {\tt sdms} is retained, except for
the data selection.
</description>
<input>
     <param type="string" name="ms_name">
     <description>New MeasurementSet to be processed</description>
     <value></value>
     </param>
</input>
<returns type="bool">
</returns>
<example>
sdms.open('m100_sd.ms')
</example>
</method>

<method type="function" name="close">
   <shortdescription>Close the {\tt sdms} tool, with data written on disk, keeping sdms running for future use
   </shortdescription>
   <description>
This is used to close {\tt sdms} tools. Note that the
data is written to disk and detached from {\tt sdms} tool.
This is a synonym for done.
   </description>
   <returns type="bool"/>
   <example>
sdms.close()
   </example>
</method>

<method type="function" name="done">
  <shortdescription>Close the {\tt sdms} tool</shortdescription>

  <description>
This is used to close and {\tt sdms} tools. Note that the
data is written to disk  and detached from {\tt sdms} tool.
This is a synonym for close.
  </description>
  <returns type="bool"></returns>
   <example>
sdms.done()
   </example>
</method>

<method type="function" name="name">
  <shortdescription>Provide the name of the attached MeasurementSet</shortdescription>
  <description>
    Returns the name of the attached MeasurementSet.
  </description>
  <returns type="string"/>
  <example>
sdms.name()
  </example>
</method>

<method type="function" name="scale">
  <shortdescription>Multiply a scaling factor to spectra
  </shortdescription>
  <description>
Multipy a scaling factor to selected spectra.
  </description>
  <input>

    <param type="float" name="factor">
      <description>the scaling factor</description>
      <value>1.0</value>
    </param>

  </input>
  <returns type="bool"/>
  <example>
sdms.open('m100_sd.ms')
sdms.set_selection(field='M100')
sdms.scale(factor=2.0)
  </example>
</method>

<method type="function" name="set_selection">
  <shortdescription>Select Measurementset to process</shortdescription>
  
  <description>

  </description>
  <input>
    
      <param type="any" name="spw">
     <description>Spectral Window Ids (0 relative) to select; -1 interpreted as all</description>
     <any type="variant"/>
     <value></value>
     </param>

     <param type="any" name="field">
     <any type="variant"/>
     <description>Field Ids (0 relative) or Field names (msselection syntax and wilcards are used) to select</description>
     <any type="variant"/>
     <value></value>
     </param>

     <param type="any" name="baseline">
     <description>Antenna Ids (0 relative) or Antenna names (msselection syntax and wilcards are used) to select</description>
     <any type="variant"/>
     <value></value>
     </param>

     <param type="any" name="time">
     <description>Limit data selected to be within a given time range. Syntax is the defined in the msselection link</description>
     <any type="variant"/>
     <value></value>
     </param>

     <param type="any" name="scan">
     <description>Limit data selected on scan numbers. Syntax is the defined in the msselection link</description>
     <any type="variant"/>
     <value></value>
     </param>
     
     <param type="any" name="observation">
     <description>Select data by observation ID(s).  The syntax is the same as for scan numbers.</description>
     <any type="variant"/>
     <value></value>
     </param>
     
     <param type="any" name="polarization">
     <description>Select data by polarization(s).</description>
     <any type="variant"/>
     <value></value>
     </param>
     
     <param type="any" name="beam">
     <description>Beam Ids (0 relative) to select; CURRENTLY NOT AVAILABLE!!!</description>
     <any type="variant"/>
     <value></value>
     </param>

     <param type="string" name="taql">
     <description>For the TAQL experts, flexible data selection using the TAQL syntax</description>
     <value></value>
     </param>
 
  </input>
  <returns type="bool"/>
  <example>
sdms.set_selection(field="M100", spw="3,5")
  </example>
</method>

</tool>
</casaxml>
